post_id,text,post_text,shared_text,time,image,video,video_thumbnail,video_id,likes,comments,shares,post_url,link,user_id,images
10156853468711056,"GEMS is providing essential services to our members during this challenging time. If you'd like to help us continue serving #GemsGirls, please visit our site to donate online! Thank you! https://bit.ly/3brZzHJ

GEMS-GIRLS.NETWORKFORGOOD.COM
The easiest way to support GEMS? Donations.","GEMS is providing essential services to our members during this challenging time. If you'd like to help us continue serving #GemsGirls, please visit our site to donate online! Thank you! https://bit.ly/3brZzHJ","GEMS-GIRLS.NETWORKFORGOOD.COM
The easiest way to support GEMS? Donations.",2020-03-24 21:19:01,,,,,3,0,0,https://facebook.com/story.php?story_fbid=10156853468711056&id=74771361055,https://bit.ly/3brZzHJ,74771361055,[]
10156850331261056,"No need to fret, we are #inthistogether. SELF has 10 tips to help ease your mind. #GemsGirls https://bit.ly/3adrmLT

SELF.COM
10 Realistic Tips for Managing Coronavirus Anxiety","No need to fret, we are #inthistogether. SELF has 10 tips to help ease your mind. #GemsGirls https://bit.ly/3adrmLT","SELF.COM
10 Realistic Tips for Managing Coronavirus Anxiety",2020-03-24 01:53:34,,,,,4,0,4,https://facebook.com/story.php?story_fbid=10156850331261056&id=74771361055,https://bit.ly/3adrmLT,74771361055,[]
10156838537951056,"Last week news broke about Harvey Weinstein’s 23 year sentencing. GEMS thinks of all the women who spoke up against his criminal sexual acts. #GemsGirls #TimesUp #Metoo https://nyti.ms/38ZPn7H

NYTIMES.COM
Harvey Weinstein’s Stunning Downfall: 23 Years in Prison",Last week news broke about Harvey Weinstein’s 23 year sentencing. GEMS thinks of all the women who spoke up against his criminal sexual acts. #GemsGirls #TimesUp #Metoo https://nyti.ms/38ZPn7H,"NYTIMES.COM
Harvey Weinstein’s Stunning Downfall: 23 Years in Prison",2020-03-21 01:41:01,,,,,19,1,0,https://facebook.com/story.php?story_fbid=10156838537951056&id=74771361055,https://nyti.ms/38ZPn7H,74771361055,[]
10156837328951056,We've transitioned to remote programming at this time due to coronavirus concerns. We're still active and providing services for our girls though and ask that you visit our site to learn more about how you can help. Thank you! #GemsGirls,We've transitioned to remote programming at this time due to coronavirus concerns. We're still active and providing services for our girls though and ask that you visit our site to learn more about how you can help. Thank you! #GemsGirls,,2020-03-20 18:53:05,https://scontent.fadd1-1.fna.fbcdn.net/v/t1.0-9/90177011_10156837328796056_952405080877826048_n.png?_nc_cat=106&ccb=2&_nc_sid=8024bb&_nc_ohc=W0gVwCol1swAX87WVpF&_nc_ht=scontent.fadd1-1.fna&oh=a45bd3967362a514e44d673227c4a8f1&oe=5FF834D9,,,,7,0,0,https://facebook.com/story.php?story_fbid=10156837328951056&id=74771361055,,74771361055,"['https://scontent.fadd1-1.fna.fbcdn.net/v/t1.0-9/90177011_10156837328796056_952405080877826048_n.png?_nc_cat=106&ccb=2&_nc_sid=8024bb&_nc_ohc=W0gVwCol1swAX87WVpF&_nc_ht=scontent.fadd1-1.fna&oh=a45bd3967362a514e44d673227c4a8f1&oe=5FF834D9', 'https://scontent.fadd1-1.fna.fbcdn.net/v/t1.0-9/90400937_10156837328866056_3298809237248933888_n.png?_nc_cat=108&ccb=2&_nc_sid=8024bb&_nc_ohc=CbxR_umlBF4AX8dZIx0&_nc_ht=scontent.fadd1-1.fna&oh=693029005299b28bb8a82081288bd98c&oe=5FF67653', 'https://scontent.fadd1-1.fna.fbcdn.net/v/t1.0-9/90080477_10156837328911056_4450566165768437760_n.png?_nc_cat=105&ccb=2&_nc_sid=8024bb&_nc_ohc=8qJN2bslv6cAX9YQeJR&_nc_ht=scontent.fadd1-1.fna&oh=7fd27c5ad7e7717ce4bdf92d3ec002a6&oe=5FF7FD48']"
