post_id,text,post_text,shared_text,time,image,video,video_thumbnail,video_id,likes,comments,shares,post_url,link,user_id,images
10157527456371056,"Thank you everyone for supporting us on Giving Tuesday!!!
If you haven't donated, you can still support. Please check out our GEMS Amazon toy wishlist for our members’ little ones! 😊🎁 Amazonwishlist https://www.amazon.com/hz/wishlist/ls/ZUGFLCB7BKIW?leftNavSection=Shopping&ref_=abls_lnv_sl","Thank you everyone for supporting us on Giving Tuesday!!!
If you haven't donated, you can still support. Please check out our GEMS Amazon toy wishlist for our members’ little ones! 😊🎁 Amazonwishlist https://www.amazon.com/hz/wishlist/ls/ZUGFLCB7BKIW?leftNavSection=Shopping&ref_=abls_lnv_sl",,2020-12-09 22:22:23,https://scontent.fadd1-1.fna.fbcdn.net/v/t1.0-9/fr/cp0/e15/q65/130214368_10157527453016056_1118880473741986097_o.jpg?_nc_cat=106&ccb=2&_nc_sid=8024bb&_nc_ohc=MBaKOOTVKasAX_cUmmR&_nc_ht=scontent.fadd1-1.fna&tp=14&oh=68baff2d82acdf5c2cce682d02f793b5&oe=5FF65080,,,,2,0,0,https://facebook.com/story.php?story_fbid=10157527456371056&id=74771361055,https://www.amazon.com/hz/wishlist/ls/ZUGFLCB7BKIW?leftNavSection=Shopping&ref_=abls_lnv_sl,74771361055,['https://scontent.fadd1-1.fna.fbcdn.net/v/t1.0-9/fr/cp0/e15/q65/130214368_10157527453016056_1118880473741986097_o.jpg?_nc_cat=106&ccb=2&_nc_sid=8024bb&_nc_ohc=MBaKOOTVKasAX_cUmmR&_nc_ht=scontent.fadd1-1.fna&tp=14&oh=68baff2d82acdf5c2cce682d02f793b5&oe=5FF65080']
10157498063351056,"This year, Thanksgiving is harder for the girls & young women we serve. In this season of giving, we are providing our members with gift cards and we hope that you can give too. Please click the link in our bio to donate $50 or more towards our member gift cards. Anything you can contribute helps, tremendously! THANK YOU & HAPPY THANKSGIVING! 🍁🦃 💕 #thanksgiving #thankful #givethanks #GivingTuesday #gemsgirls #girlsarenotforsale","This year, Thanksgiving is harder for the girls & young women we serve. In this season of giving, we are providing our members with gift cards and we hope that you can give too. Please click the link in our bio to donate $50 or more towards our member gift cards. Anything you can contribute helps, tremendously! THANK YOU & HAPPY THANKSGIVING! 🍁🦃 💕 #thanksgiving #thankful #givethanks #GivingTuesday #gemsgirls #girlsarenotforsale",,2020-11-26 05:01:58,,,,,6,0,0,https://facebook.com/story.php?story_fbid=10157498063351056&id=74771361055,,74771361055,[]
10157449578116056,"Read our CEO Rachel Lloyd’s piece on why there’s only one choice tomorrow that supports trafficking victims and survivors and that helps protect at risk youth

https://link.medium.com/yJcydnfi6ab","Read our CEO Rachel Lloyd’s piece on why there’s only one choice tomorrow that supports trafficking victims and survivors and that helps protect at risk youth

https://link.medium.com/yJcydnfi6ab",,2020-11-03 05:27:37,https://scontent.fadd1-1.fna.fbcdn.net/v/t1.0-9/fr/cp0/e15/q65/123606653_10157449573356056_4996268446226880296_n.jpg?_nc_cat=100&ccb=2&_nc_sid=110474&_nc_ohc=TUeaGicl6GMAX_FVifq&_nc_ht=scontent.fadd1-1.fna&tp=14&oh=0a5098d487c2d4f4d77b17adfeb8a54f&oe=5FF60FEC,,,,107,47,0,https://facebook.com/story.php?story_fbid=10157449578116056&id=74771361055,https://link.medium.com/yJcydnfi6ab,74771361055,['https://scontent.fadd1-1.fna.fbcdn.net/v/t1.0-9/fr/cp0/e15/q65/123606653_10157449573356056_4996268446226880296_n.jpg?_nc_cat=100&ccb=2&_nc_sid=110474&_nc_ohc=TUeaGicl6GMAX_FVifq&_nc_ht=scontent.fadd1-1.fna&tp=14&oh=0a5098d487c2d4f4d77b17adfeb8a54f&oe=5FF60FEC']
10157449571046056,"Read our CEO Rachel Lloyd’s piece to understand why there’s only one vote tomorrow that supports trafficking victims and survivors - and helps protect at risk youth..

https://link.medium.com/yJcydnfi6ab","Read our CEO Rachel Lloyd’s piece to understand why there’s only one vote tomorrow that supports trafficking victims and survivors - and helps protect at risk youth..

https://link.medium.com/yJcydnfi6ab",,2020-11-03 05:24:23,https://scontent.fadd1-1.fna.fbcdn.net/v/t1.0-9/fr/cp0/e15/q65/123612893_10157449564201056_4580299766702852084_n.jpg?_nc_cat=107&ccb=2&_nc_sid=110474&_nc_ohc=3ozUyXKO3NYAX_qEr6j&_nc_oc=AQk5yL2fYHkgAcnD7Usl4jzf2Y4qHFyGWGken1dKl2fHhgr06O2drvWPSoWbjPRWmLc&_nc_ht=scontent.fadd1-1.fna&tp=14&oh=1fbfa50e7f2b200f9edaad835f75e766&oe=5FF8B811,,,,165,94,0,https://facebook.com/story.php?story_fbid=10157449571046056&id=74771361055,https://link.medium.com/yJcydnfi6ab,74771361055,['https://scontent.fadd1-1.fna.fbcdn.net/v/t1.0-9/fr/cp0/e15/q65/123612893_10157449564201056_4580299766702852084_n.jpg?_nc_cat=107&ccb=2&_nc_sid=110474&_nc_ohc=3ozUyXKO3NYAX_qEr6j&_nc_oc=AQk5yL2fYHkgAcnD7Usl4jzf2Y4qHFyGWGken1dKl2fHhgr06O2drvWPSoWbjPRWmLc&_nc_ht=scontent.fadd1-1.fna&tp=14&oh=1fbfa50e7f2b200f9edaad835f75e766&oe=5FF8B811']
10157141848721056,"Join GEMS' Young Professionals Board Tuesday, June 30th from 6-8PM EST as we host an online screening of “Very Young Girls” followed by a Q+A with GEMS CEO and Founder, Rachel Lloyd!

https://www.eventbrite.com/e/screening-of-very-young-girls-tickets-109882999008","Join GEMS' Young Professionals Board Tuesday, June 30th from 6-8PM EST as we host an online screening of “Very Young Girls” followed by a Q+A with GEMS CEO and Founder, Rachel Lloyd!

https://www.eventbrite.com/e/screening-of-very-young-girls-tickets-109882999008",,2020-06-26 00:13:53,https://scontent.fadd1-1.fna.fbcdn.net/v/t1.0-9/104767886_10157141841826056_8460038959964500984_n.png?_nc_cat=106&ccb=2&_nc_sid=8024bb&_nc_ohc=C7tzB0-mN_MAX8zGVZn&_nc_ht=scontent.fadd1-1.fna&oh=2247e16d41640cb55ffb63d46d47f5d4&oe=5FF5924A,,,,34,4,0,https://facebook.com/story.php?story_fbid=10157141848721056&id=74771361055,https://www.eventbrite.com/e/screening-of-very-young-girls-tickets-109882999008,74771361055,['https://scontent.fadd1-1.fna.fbcdn.net/v/t1.0-9/104767886_10157141841826056_8460038959964500984_n.png?_nc_cat=106&ccb=2&_nc_sid=8024bb&_nc_ohc=C7tzB0-mN_MAX8zGVZn&_nc_ht=scontent.fadd1-1.fna&oh=2247e16d41640cb55ffb63d46d47f5d4&oe=5FF5924A']
10157072823756056,"This is from a piece I wrote 6 years ago after the murder of Michael Brown - Why Black Lives Should Matter to the Anti-Trafficking Movement. Don’t have new words right now. Black Lives Matter.

“The truth is that you can’t claim to be ‘anti-trafficking’ and not be anti-racism. Being anti-racist doesn’t just mean not saying the ‘n’ word or telling racist jokes. It means that you have to actively be engaged as an ally, question your own privilege and address all the subtle and not so subtle ways that structural racism interacts with your life.

You can’t say you care about trafficking victims of color, but not take a moment to understand how race impacts their lives. You can’t talk about prevention of commercial sexual exploitation without addressing poverty and how race and class are inextricably linked in this country. You can’t talk about options for survivors and ‘aftercare’ without acknowledging that those options look different for different survivors. You can’t sit quietly by on the sidelines because all this talk about race makes you uncomfortable. And you can’t pick and choose your social justice issues like you’re at a buffet bar.

All of this is linked, all of it is interconnected and all of this is indeed related to commercial sexual exploitation and trafficking, in all of its forms. As a movement with momentum and interest and a huge amount of support right now, we need to ensure that we’re a movement that is headed in the right direction on all issues of equality and justice, and we need to leverage that momentum to create real, lasting change. Black lives matter, and its past the time for the anti-trafficking movement to send that message loud and clear.”

#blacklivesmatter
#georgeflloydmatters
#breonnataylormatters
#ahmaudarberymatters","This is from a piece I wrote 6 years ago after the murder of Michael Brown - Why Black Lives Should Matter to the Anti-Trafficking Movement. Don’t have new words right now. Black Lives Matter.

“The truth is that you can’t claim to be ‘anti-trafficking’ and not be anti-racism. Being anti-racist doesn’t just mean not saying the ‘n’ word or telling racist jokes. It means that you have to actively be engaged as an ally, question your own privilege and address all the subtle and not so subtle ways that structural racism interacts with your life.

You can’t say you care about trafficking victims of color, but not take a moment to understand how race impacts their lives. You can’t talk about prevention of commercial sexual exploitation without addressing poverty and how race and class are inextricably linked in this country. You can’t talk about options for survivors and ‘aftercare’ without acknowledging that those options look different for different survivors. You can’t sit quietly by on the sidelines because all this talk about race makes you uncomfortable. And you can’t pick and choose your social justice issues like you’re at a buffet bar.

All of this is linked, all of it is interconnected and all of this is indeed related to commercial sexual exploitation and trafficking, in all of its forms. As a movement with momentum and interest and a huge amount of support right now, we need to ensure that we’re a movement that is headed in the right direction on all issues of equality and justice, and we need to leverage that momentum to create real, lasting change. Black lives matter, and its past the time for the anti-trafficking movement to send that message loud and clear.”

#blacklivesmatter
#georgeflloydmatters
#breonnataylormatters
#ahmaudarberymatters",,2020-06-01 08:05:54,,,,,96,5,0,https://facebook.com/story.php?story_fbid=10157072823756056&id=74771361055,,74771361055,[]
10156995772556056,It’s basically Wednesday now but we won’t turn down any donations because of that! Whether you’re able to give or not for #GivingTuesdayNow check out our video with an update on how we’ve been addressing the crisis and some of amazing things we’ve been able to accomplish during a really difficult time. #gemsgirls #survivorslead,It’s basically Wednesday now but we won’t turn down any donations because of that! Whether you’re able to give or not for #GivingTuesdayNow check out our video with an update on how we’ve been addressing the crisis and some of amazing things we’ve been able to accomplish during a really difficult time. #gemsgirls #survivorslead,,2020-05-06 06:31:24,,,,,4,0,0,https://facebook.com/story.php?story_fbid=10156995772556056&id=74771361055,,74771361055,[]
10156924937461056,Check out these beautiful soaps that the girls and women in our Transitional Independent Living program made last week. We're getting creative to fend off cabin fever! #gemsgirls,Check out these beautiful soaps that the girls and women in our Transitional Independent Living program made last week. We're getting creative to fend off cabin fever! #gemsgirls,,2020-04-15 18:52:15,https://scontent.fadd1-1.fna.fbcdn.net/v/t1.0-9/fr/cp0/e15/q65/93641378_10156924930376056_5393446057155756032_n.jpg?_nc_cat=107&ccb=2&_nc_sid=8024bb&_nc_ohc=A1GmLLcz1DAAX_zuJq9&_nc_ht=scontent.fadd1-1.fna&tp=14&oh=6912ebe8c55e3c5e80aac884da648091&oe=5FF91FF7,,,,36,2,0,https://facebook.com/story.php?story_fbid=10156924937461056&id=74771361055,,74771361055,['https://scontent.fadd1-1.fna.fbcdn.net/v/t1.0-9/fr/cp0/e15/q65/93641378_10156924930376056_5393446057155756032_n.jpg?_nc_cat=107&ccb=2&_nc_sid=8024bb&_nc_ohc=A1GmLLcz1DAAX_zuJq9&_nc_ht=scontent.fadd1-1.fna&tp=14&oh=6912ebe8c55e3c5e80aac884da648091&oe=5FF91FF7']
10156924922201056,,,,2020-04-15 18:44:58,https://scontent.fadd1-1.fna.fbcdn.net/v/t1.0-9/93045960_10156924922111056_5278933192433205248_n.png?_nc_cat=102&ccb=2&_nc_sid=dd9801&_nc_ohc=MkcO0vB6BAQAX97LdeC&_nc_ht=scontent.fadd1-1.fna&oh=422b0e528083fdf2ec51cdcafdff0087&oe=5FF6ED9D,,,,10,0,0,,,74771361055,"['https://scontent.fadd1-1.fna.fbcdn.net/v/t1.0-9/93045960_10156924922111056_5278933192433205248_n.png?_nc_cat=102&ccb=2&_nc_sid=dd9801&_nc_ohc=MkcO0vB6BAQAX97LdeC&_nc_ht=scontent.fadd1-1.fna&oh=422b0e528083fdf2ec51cdcafdff0087&oe=5FF6ED9D', 'https://scontent.fadd1-1.fna.fbcdn.net/v/t1.0-9/93045960_10156924922111056_5278933192433205248_n.png?_nc_cat=102&ccb=2&_nc_sid=dd9801&_nc_ohc=MkcO0vB6BAQAX97LdeC&_nc_ht=scontent.fadd1-1.fna&oh=422b0e528083fdf2ec51cdcafdff0087&oe=5FF6ED9D', 'https://scontent.fadd1-1.fna.fbcdn.net/v/t1.0-9/93045960_10156924922111056_5278933192433205248_n.png?_nc_cat=102&ccb=2&_nc_sid=dd9801&_nc_ohc=MkcO0vB6BAQAX97LdeC&_nc_ht=scontent.fadd1-1.fna&oh=422b0e528083fdf2ec51cdcafdff0087&oe=5FF6ED9D']"
10156919302231056,"Virtual GEMS has a busy week ahead with daily meditations, zoom groups like Economic Empowerment and Women's Wellness, nightly check-ins, and ongoing support for the survivors in our program. #COVID19 has changed the world for the moment, but it's not slowing us down. #gemsgirls","Virtual GEMS has a busy week ahead with daily meditations, zoom groups like Economic Empowerment and Women's Wellness, nightly check-ins, and ongoing support for the survivors in our program. #COVID19 has changed the world for the moment, but it's not slowing us down. #gemsgirls",,2020-04-13 22:25:04,https://scontent.fadd1-1.fna.fbcdn.net/v/t1.0-9/fr/cp0/e15/q65/93418502_10156919300176056_7538515259225538560_n.jpg?_nc_cat=106&ccb=2&_nc_sid=110474&_nc_ohc=cVC5T3jlsrwAX8YDeHq&_nc_ht=scontent.fadd1-1.fna&tp=14&oh=70044e869343b0f7d7086f81bfc10905&oe=5FF9166D,,,,5,0,0,https://facebook.com/story.php?story_fbid=10156919302231056&id=74771361055,,74771361055,['https://scontent.fadd1-1.fna.fbcdn.net/v/t1.0-9/fr/cp0/e15/q65/93418502_10156919300176056_7538515259225538560_n.jpg?_nc_cat=106&ccb=2&_nc_sid=110474&_nc_ohc=cVC5T3jlsrwAX8YDeHq&_nc_ht=scontent.fadd1-1.fna&tp=14&oh=70044e869343b0f7d7086f81bfc10905&oe=5FF9166D']
10156906277551056,"#IStayHomeFor the girls and women we serve at GEMS. Our virtual programming is ongoing and we’re working hard to keep our girls safe, well, and connected to vital services during this high-risk time #gemsgirls #COVID","#IStayHomeFor the girls and women we serve at GEMS. Our virtual programming is ongoing and we’re working hard to keep our girls safe, well, and connected to vital services during this high-risk time #gemsgirls #COVID",,2020-04-09 19:50:09,https://scontent.fadd1-1.fna.fbcdn.net/v/t1.0-9/fr/cp0/e15/q65/93056355_10156906277041056_2103249212882812928_n.jpg?_nc_cat=100&ccb=2&_nc_sid=110474&_nc_ohc=rHCqnb_zFNsAX8Tgq6p&_nc_ht=scontent.fadd1-1.fna&tp=14&oh=21a1bfadd3cbaf4dc5c74e9719332eb2&oe=5FF5B380,,,,18,0,0,https://facebook.com/story.php?story_fbid=10156906277551056&id=74771361055,,74771361055,['https://scontent.fadd1-1.fna.fbcdn.net/v/t1.0-9/fr/cp0/e15/q65/93056355_10156906277041056_2103249212882812928_n.jpg?_nc_cat=100&ccb=2&_nc_sid=110474&_nc_ohc=rHCqnb_zFNsAX8Tgq6p&_nc_ht=scontent.fadd1-1.fna&tp=14&oh=21a1bfadd3cbaf4dc5c74e9719332eb2&oe=5FF5B380']
10156887228546056,"In times of uncertainty, you can always count on yourself. #GEMSGirls #Quotegraphic","In times of uncertainty, you can always count on yourself. #GEMSGirls #Quotegraphic",,2020-04-03 19:58:02,https://scontent.fadd1-1.fna.fbcdn.net/v/t1.0-9/92097335_10156887228556056_8868033994998939648_o.png?_nc_cat=107&ccb=2&_nc_sid=da1649&_nc_ohc=BL6ct_TJEx4AX_kopRg&_nc_ht=scontent.fadd1-1.fna&oh=34b2723346e0d7aac9756d33f711890d&oe=5FF7E3B3,,,,20,0,0,,,74771361055,"['https://scontent.fadd1-1.fna.fbcdn.net/v/t1.0-9/92097335_10156887228556056_8868033994998939648_o.png?_nc_cat=107&ccb=2&_nc_sid=da1649&_nc_ohc=BL6ct_TJEx4AX_kopRg&_nc_ht=scontent.fadd1-1.fna&oh=34b2723346e0d7aac9756d33f711890d&oe=5FF7E3B3', 'https://scontent.fadd1-1.fna.fbcdn.net/v/t1.0-9/92097335_10156887228556056_8868033994998939648_o.png?_nc_cat=107&ccb=2&_nc_sid=da1649&_nc_ohc=BL6ct_TJEx4AX_kopRg&_nc_ht=scontent.fadd1-1.fna&oh=34b2723346e0d7aac9756d33f711890d&oe=5FF7E3B3', 'https://scontent.fadd1-1.fna.fbcdn.net/v/t1.0-9/92097335_10156887228556056_8868033994998939648_o.png?_nc_cat=107&ccb=2&_nc_sid=da1649&_nc_ohc=BL6ct_TJEx4AX_kopRg&_nc_ht=scontent.fadd1-1.fna&oh=34b2723346e0d7aac9756d33f711890d&oe=5FF7E3B3']"
10156883900116056,"Meditation can help ease stress & anxiety. Try out these meditations from Shine Text! #ThursdayThoughts https://bit.ly/3ay8qHS

VIRUSANXIETY.COM
Free Meditations | Care for Your Coronavirus Anxiety",Meditation can help ease stress & anxiety. Try out these meditations from Shine Text! #ThursdayThoughts https://bit.ly/3ay8qHS,"VIRUSANXIETY.COM
Free Meditations | Care for Your Coronavirus Anxiety",2020-04-02 20:15:05,,,,,1,0,0,https://facebook.com/story.php?story_fbid=10156883900116056&id=74771361055,https://bit.ly/3ay8qHS,74771361055,[]
10156877576361056,"Donations to #GEMSGirls matter now more than ever. If you'd like to donate via Zelle, please see the instructions linked here or visit our website. https://bit.ly/2UOsVtq

DOCS.GOOGLE.COM
Zelle instructions","Donations to #GEMSGirls matter now more than ever. If you'd like to donate via Zelle, please see the instructions linked here or visit our website. https://bit.ly/2UOsVtq","DOCS.GOOGLE.COM
Zelle instructions",2020-03-31 21:22:02,,,,,2,0,0,https://facebook.com/story.php?story_fbid=10156877576361056&id=74771361055,https://bit.ly/2UOsVtq,74771361055,[]
10156874255096056,#MotivationMonday from Alicia Keys #GEMSGirls #Quotegraphic,#MotivationMonday from Alicia Keys #GEMSGirls #Quotegraphic,,2020-03-30 21:25:35,https://scontent.fadd1-1.fna.fbcdn.net/v/t1.0-9/91578529_10156874255121056_7599997716067778560_o.png?_nc_cat=103&ccb=2&_nc_sid=da1649&_nc_ohc=ifwguPau8LsAX9DxKJB&_nc_ht=scontent.fadd1-1.fna&oh=fed89dca683aff414f38dd4d316431a8&oe=5FF635B6,,,,20,0,0,,,74771361055,"['https://scontent.fadd1-1.fna.fbcdn.net/v/t1.0-9/91578529_10156874255121056_7599997716067778560_o.png?_nc_cat=103&ccb=2&_nc_sid=da1649&_nc_ohc=ifwguPau8LsAX9DxKJB&_nc_ht=scontent.fadd1-1.fna&oh=fed89dca683aff414f38dd4d316431a8&oe=5FF635B6', 'https://scontent.fadd1-1.fna.fbcdn.net/v/t1.0-9/91578529_10156874255121056_7599997716067778560_o.png?_nc_cat=103&ccb=2&_nc_sid=da1649&_nc_ohc=ifwguPau8LsAX9DxKJB&_nc_ht=scontent.fadd1-1.fna&oh=fed89dca683aff414f38dd4d316431a8&oe=5FF635B6', 'https://scontent.fadd1-1.fna.fbcdn.net/v/t1.0-9/91578529_10156874255121056_7599997716067778560_o.png?_nc_cat=103&ccb=2&_nc_sid=da1649&_nc_ohc=ifwguPau8LsAX9DxKJB&_nc_ht=scontent.fadd1-1.fna&oh=fed89dca683aff414f38dd4d316431a8&oe=5FF635B6']"
10156868790776056,#GemsGirls can always count on inspiration from Rihanna,#GemsGirls can always count on inspiration from Rihanna,,2020-03-29 02:54:00,https://scontent.fadd1-1.fna.fbcdn.net/v/t1.0-9/91038244_10156868790786056_3699156350228496384_o.png?_nc_cat=110&ccb=2&_nc_sid=da1649&_nc_ohc=xilLZgvJenQAX9VI8KM&_nc_ht=scontent.fadd1-1.fna&oh=da372fa2d58b1bd958da3f4356d11285&oe=5FF5E699,,,,37,1,0,,,74771361055,"['https://scontent.fadd1-1.fna.fbcdn.net/v/t1.0-9/91038244_10156868790786056_3699156350228496384_o.png?_nc_cat=110&ccb=2&_nc_sid=da1649&_nc_ohc=xilLZgvJenQAX9VI8KM&_nc_ht=scontent.fadd1-1.fna&oh=da372fa2d58b1bd958da3f4356d11285&oe=5FF5E699', 'https://scontent.fadd1-1.fna.fbcdn.net/v/t1.0-9/91038244_10156868790786056_3699156350228496384_o.png?_nc_cat=110&ccb=2&_nc_sid=da1649&_nc_ohc=xilLZgvJenQAX9VI8KM&_nc_ht=scontent.fadd1-1.fna&oh=da372fa2d58b1bd958da3f4356d11285&oe=5FF5E699', 'https://scontent.fadd1-1.fna.fbcdn.net/v/t1.0-9/91038244_10156868790786056_3699156350228496384_o.png?_nc_cat=110&ccb=2&_nc_sid=da1649&_nc_ohc=xilLZgvJenQAX9VI8KM&_nc_ht=scontent.fadd1-1.fna&oh=da372fa2d58b1bd958da3f4356d11285&oe=5FF5E699']"
10156865009241056,"Happy Birthday, Rachel! We're celebrating our inspirational founders' birthday this weekend and we're so proud of her amazing work creating the GEMS community over the last 22 years. She remains committed to serving the girls and women in our program and she's working overtime during this crisis to ensure GEMS continues to be a safe and healing place (albeit virtually at the moment) for #GemsGirls.

In honor of her birthday, please consider donating to support GEMS during this critical time of need. To donate please visit our website here: http://bitly.ws/86oa

THANK YOU!","Happy Birthday, Rachel! We're celebrating our inspirational founders' birthday this weekend and we're so proud of her amazing work creating the GEMS community over the last 22 years. She remains committed to serving the girls and women in our program and she's working overtime during this crisis to ensure GEMS continues to be a safe and healing place (albeit virtually at the moment) for #GemsGirls.

In honor of her birthday, please consider donating to support GEMS during this critical time of need. To donate please visit our website here: http://bitly.ws/86oa

THANK YOU!",,2020-03-28 00:02:14,https://scontent.fadd1-1.fna.fbcdn.net/v/t1.0-9/fr/cp0/e15/q65/91199092_10156864937781056_2205870034717245440_o.jpg?_nc_cat=105&ccb=2&_nc_sid=8024bb&_nc_ohc=FRllwrx2TwsAX83weKA&_nc_ht=scontent.fadd1-1.fna&tp=14&oh=e2723d0a69cf3c210ae913a03c6f514f&oe=5FF785C1,,,,66,11,0,https://facebook.com/story.php?story_fbid=10156865009241056&id=74771361055,http://bitly.ws/86oa,74771361055,['https://scontent.fadd1-1.fna.fbcdn.net/v/t1.0-9/fr/cp0/e15/q65/91199092_10156864937781056_2205870034717245440_o.jpg?_nc_cat=105&ccb=2&_nc_sid=8024bb&_nc_ohc=FRllwrx2TwsAX83weKA&_nc_ht=scontent.fadd1-1.fna&tp=14&oh=e2723d0a69cf3c210ae913a03c6f514f&oe=5FF785C1']
10156863905276056,"Stuck at home? Time to shop online and give back to #GemsGirls! Check out our Amazon.com wish list and donate items that really matter.
https://bit.ly/2WTy6Lp

GEMS-GIRLS.ORG
Everyday Needs Items — Girls Educational & Mentoring Services (GEMS)","Stuck at home? Time to shop online and give back to #GemsGirls! Check out our Amazon.com wish list and donate items that really matter.
https://bit.ly/2WTy6Lp","GEMS-GIRLS.ORG
Everyday Needs Items — Girls Educational & Mentoring Services (GEMS)",2020-03-27 18:40:02,,,,,3,0,0,https://facebook.com/story.php?story_fbid=10156863905276056&id=74771361055,https://bit.ly/2WTy6Lp,74771361055,[]
10156863616741056,"We have a lot of needs to provide for #GemsGirls during this crisis. If you're able to help, please consider visiting our Amazon Wishlist here. Thank you!

AMAZON.COM
Help me build my list on Amazon","We have a lot of needs to provide for #GemsGirls during this crisis. If you're able to help, please consider visiting our Amazon Wishlist here. Thank you!","AMAZON.COM
Help me build my list on Amazon",2020-03-27 16:56:25,,,,,3,0,3,https://facebook.com/story.php?story_fbid=10156863616741056&id=74771361055,https://www.amazon.com/hz/wishlist/dl/invite/2DdvUl9?ref_=wl_share,74771361055,[]
10156860410126056,"There is no better time than now to educate yourself on issues that matter. Check out GEMS Founder Rachel Lloyd’s book, Girls Like Us, to learn about the dark world of commercial sex trafficking. https://bit.ly/2wvg9r1

GEMS-GIRLS.ORG
Shop — Girls Educational & Mentoring Services (GEMS)","There is no better time than now to educate yourself on issues that matter. Check out GEMS Founder Rachel Lloyd’s book, Girls Like Us, to learn about the dark world of commercial sex trafficking. https://bit.ly/2wvg9r1","GEMS-GIRLS.ORG
Shop — Girls Educational & Mentoring Services (GEMS)",2020-03-26 20:03:02,,,,,4,0,3,https://facebook.com/story.php?story_fbid=10156860410126056&id=74771361055,https://bit.ly/2wvg9r1,74771361055,[]
10156859934201056,"This The New York Times article echoes what many of the girls and women we serve are facing right now. #GemsGirls

NYTIMES.COM
She’s 10, Homeless and Eager to Learn. But She Has No Internet.",This The New York Times article echoes what many of the girls and women we serve are facing right now. #GemsGirls,"NYTIMES.COM
She’s 10, Homeless and Eager to Learn. But She Has No Internet.",2020-03-26 17:33:15,,,,,12,2,15,https://facebook.com/story.php?story_fbid=10156859934201056&id=74771361055,https://www.nytimes.com/2020/03/26/nyregion/new-york-homeless-students-coronavirus.html?action=click&module=Top%20Stories&pgtype=Homepage,74771361055,[]
10156857042821056,"Women have always been steady leaders, helping the world navigate difficult times. In the midst of today’s news, let us not forget the legacy of those who came before us. #WomensHistoryMonth","Women have always been steady leaders, helping the world navigate difficult times. In the midst of today’s news, let us not forget the legacy of those who came before us. #WomensHistoryMonth",,2020-03-25 20:36:02,https://scontent.fadd1-1.fna.fbcdn.net/v/t1.0-9/90933424_10156857042826056_4426958396989636608_o.png?_nc_cat=109&ccb=2&_nc_sid=da1649&_nc_ohc=TAO0wsNNR1EAX-jyApZ&_nc_ht=scontent.fadd1-1.fna&oh=d6ebcd07eb2e7e36a67917fdd7b1d410&oe=5FF8EDD8,,,,6,0,0,,,74771361055,"['https://scontent.fadd1-1.fna.fbcdn.net/v/t1.0-9/90933424_10156857042826056_4426958396989636608_o.png?_nc_cat=109&ccb=2&_nc_sid=da1649&_nc_ohc=TAO0wsNNR1EAX-jyApZ&_nc_ht=scontent.fadd1-1.fna&oh=d6ebcd07eb2e7e36a67917fdd7b1d410&oe=5FF8EDD8', 'https://scontent.fadd1-1.fna.fbcdn.net/v/t1.0-9/90933424_10156857042826056_4426958396989636608_o.png?_nc_cat=109&ccb=2&_nc_sid=da1649&_nc_ohc=TAO0wsNNR1EAX-jyApZ&_nc_ht=scontent.fadd1-1.fna&oh=d6ebcd07eb2e7e36a67917fdd7b1d410&oe=5FF8EDD8', 'https://scontent.fadd1-1.fna.fbcdn.net/v/t1.0-9/90933424_10156857042826056_4426958396989636608_o.png?_nc_cat=109&ccb=2&_nc_sid=da1649&_nc_ohc=TAO0wsNNR1EAX-jyApZ&_nc_ht=scontent.fadd1-1.fna&oh=d6ebcd07eb2e7e36a67917fdd7b1d410&oe=5FF8EDD8']"
